[
  {
    "title": "XR for Challenging Environments - Enabling Human Performance and Agency under Stress",
    "category": "Workshops",
    "sessionTime": "",
    "authors": [
      "Raimund Schatz",
      "Helmut Schrom-Feiertag",
      "Guglielmo Papagni",
      "Frank Steinicke",
      "Lea Skorin-Kapov",
      "Mark Billinghurst",
      "Leif Oppermann",
      "Georg Aumayr"
    ],
    "link": "https://programs.sigchi.org/chi/2026/program/content/214845",
    "raw": {
      "affiliation": "Adelaide University",
      "item_id": "214845",
      "item_type": "Workshops",
      "title": "XR for Challenging Environments - Enabling Human Performance and Agency under Stress",
      "item_url": "https://programs.sigchi.org/chi/2026/program/content/214845",
      "authors": "Raimund Schatz , Helmut Schrom-Feiertag , Guglielmo Papagni , Frank Steinicke , Lea Skorin-Kapov , Mark Billinghurst , Leif Oppermann , Georg Aumayr",
      "authors_with_affiliations": "Mark Billinghurst",
      "Awards": ""
    }
  },
  {
    "title": "Exploring the Effects of Support Type and Task Difficulty for Virtual Assistants as Social Companions",
    "category": "Papers",
    "sessionTime": "",
    "authors": [
      "Sei Kang",
      "YunSu Lee",
      "Gun A. Lee",
      "Hyung-Jeong Yang",
      "Soo-Hyung Kim",
      "Ji-eun Shin",
      "Seungwon Kim"
    ],
    "link": "https://programs.sigchi.org/chi/2026/program/content/222290",
    "raw": {
      "affiliation": "Adelaide University",
      "item_id": "222290",
      "item_type": "Papers",
      "title": "Exploring the Effects of Support Type and Task Difficulty for Virtual Assistants as Social Companions",
      "item_url": "https://programs.sigchi.org/chi/2026/program/content/222290",
      "authors": "Sei Kang , YunSu Lee , Gun A. Lee , Hyung-Jeong Yang , Soo-Hyung Kim , Ji-eun Shin , Seungwon Kim",
      "authors_with_affiliations": "Gun A. Lee",
      "Awards": ""
    }
  },
  {
    "title": "Less is More! Visual Suppression for Bottom-up and Top-down Attention in Dynamic Environments",
    "category": "Papers",
    "sessionTime": "",
    "authors": [
      "Chenkai Zhang",
      "Ruochen Cao",
      "Andrew Cunningham",
      "James A. Walsh"
    ],
    "link": "https://programs.sigchi.org/chi/2026/program/content/223269 ",
    "raw": {
      "affiliation": "Adelaide University",
      "item_id": "223269",
      "item_type": "Papers",
      "title": "Less is More! Visual Suppression for Bottom-up and Top-down Attention in Dynamic Environments",
      "item_url": "https://programs.sigchi.org/chi/2026/program/content/223269 ",
      "authors": "Chenkai Zhang , Ruochen Cao , Andrew Cunningham , James A. Walsh",
      "authors_with_affiliations": "Andrew Cunningham",
      "Awards": ""
    }
  },
  {
    "title": "Towards LLM-powered Assistive Drone for Blind and Low Vision Users",
    "category": "Papers",
    "sessionTime": "",
    "authors": [
      "Yize Wei",
      "Ibnu Taimiyyah Bin Adam",
      "Hanjun Wu",
      "Moritz Alexander Messerschmidt",
      "Wei Tsang Ooi",
      "Christophe Jouffrais",
      "Suranga Nanayakkara"
    ],
    "link": "https://programs.sigchi.org/chi/2026/program/content/222811",
    "raw": {
      "affiliation": "Auckland Bioengineering Institute, The University of Auckland",
      "item_id": "222811",
      "item_type": "Papers",
      "title": "Towards LLM-powered Assistive Drone for Blind and Low Vision Users",
      "item_url": "https://programs.sigchi.org/chi/2026/program/content/222811",
      "authors": "Yize Wei , Ibnu Taimiyyah Bin Adam , Hanjun Wu , Moritz Alexander Messerschmidt , Wei Tsang Ooi , Christophe Jouffrais , Suranga Nanayakkara",
      "authors_with_affiliations": "Moritz Alexander Messerschmidt, Suranga Nanayakkara",
      "Awards": ""
    }
  },
  {
    "title": "InterFlow: Designing Unobtrusive AI to Empower Interviewers in Semi-Structured Interviews",
    "category": "Papers",
    "sessionTime": "",
    "authors": [
      "Yi Wen",
      "Yu Zhang",
      "Sriram Suresh",
      "Zhicong Lu",
      "Can Liu",
      "Meng Xia"
    ],
    "link": "https://programs.sigchi.org/chi/2026/program/content/222209",
    "raw": {
      "affiliation": "Australia National University",
      "item_id": "222209",
      "item_type": "Papers",
      "title": "InterFlow: Designing Unobtrusive AI to Empower Interviewers in Semi-Structured Interviews",
      "item_url": "https://programs.sigchi.org/chi/2026/program/content/222209",
      "authors": "Yi Wen , Yu Zhang , Sriram Suresh , Zhicong Lu , Can Liu , Meng Xia",
      "authors_with_affiliations": "Yu Zhang",
      "Awards": ""
    }
  },
  {
    "title": "SportsHCI Meet-Up: Exploring the Role of AI in the Evolving World of SportsHCI",
    "category": "Meet-up",
    "sessionTime": "",
    "authors": [
      "Vincent van Rheden",
      "Michelle Adiwangsa",
      "Maria Fernanda Montoya",
      "Ian Smith",
      "Don Samitha Elvitigala",
      "Daniel Harrison",
      "Amon Rapp",
      "Alexander Meschtscherjakov",
      "Florian \u2018Floyd\u2019 Mueller"
    ],
    "link": "https://programs.sigchi.org/chi/2026/program/content/214843",
    "raw": {
      "affiliation": "Australian National University",
      "item_id": "214843",
      "item_type": "Meet-up",
      "title": "SportsHCI Meet-Up: Exploring the Role of AI in the Evolving World of SportsHCI",
      "item_url": "https://programs.sigchi.org/chi/2026/program/content/214843",
      "authors": "Vincent van Rheden , Michelle Adiwangsa , Maria Fernanda Montoya , Ian Smith , Don Samitha Elvitigala , Daniel Harrison , Amon Rapp , Alexander Meschtscherjakov , Florian \u2018Floyd\u2019 Mueller",
      "authors_with_affiliations": "",
      "Awards": ""
    }
  },
  {
    "title": "Next Steps for Augmented Reality On-the-Move: Challenges and Opportunities\n",
    "category": "Workshops",
    "sessionTime": "",
    "authors": [
      "Helen Stefanidi",
      "Vincent van Rheden",
      "Linjia He",
      "Michelle Adiwangsa",
      "Jan-Hendrik S\u00fcnderkamp",
      "Alina Itzlinger",
      "Andrii Matviienko",
      "Julie R. Williamson",
      "Ian Oakley",
      "Markus Tatzgern",
      "Alexander Meschtscherjakov"
    ],
    "link": "https://programs.sigchi.org/chi/2026/program/content/214853",
    "raw": {
      "affiliation": "Australian National University",
      "item_id": "214853",
      "item_type": "Workshops",
      "title": "Next Steps for Augmented Reality On-the-Move: Challenges and Opportunities\n",
      "item_url": "https://programs.sigchi.org/chi/2026/program/content/214853",
      "authors": "Helen Stefanidi , Vincent van Rheden , Linjia He , Michelle Adiwangsa , Jan-Hendrik S\u00fcnderkamp , Alina Itzlinger , Andrii Matviienko , Julie R. Williamson , Ian Oakley , Markus Tatzgern , Alexander Meschtscherjakov",
      "authors_with_affiliations": "Helen Stefanidi, Jan-Hendrik S\u00fcnderkamp",
      "Awards": ""
    }
  },
  {
    "title": "Signals of Success and Struggle: Early Prediction and Physiological Signatures of Human Performance across Task Complexity\n",
    "category": "Papers",
    "sessionTime": "",
    "authors": [
      "Yufei Cao",
      "Penny Sweetser",
      "Ziyu Chen",
      "Xuanying Zhu"
    ],
    "link": "https://programs.sigchi.org/chi/2026/program/content/222275",
    "raw": {
      "affiliation": "Australian National University",
      "item_id": "222275",
      "item_type": "Papers",
      "title": "Signals of Success and Struggle: Early Prediction and Physiological Signatures of Human Performance across Task Complexity\n",
      "item_url": "https://programs.sigchi.org/chi/2026/program/content/222275",
      "authors": "Yufei Cao , Penny Sweetser , Ziyu Chen , Xuanying Zhu",
      "authors_with_affiliations": "",
      "Awards": ""
    }
  },
  {
    "title": "Last Christmas I Gave You My Heart: This Christmas I am Taking It Back with Multimodal XR\n",
    "category": "Interactivity",
    "sessionTime": "",
    "authors": [
      "Dezijian Zhou",
      "Yuanyuan Deng",
      "Anastasia Globa",
      "Julie Zheng",
      "Renxuan Liu",
      "Xingting Wu",
      "Tianrui Liu",
      "Donald Degraen",
      "Aaron Quigley"
    ],
    "link": "https://programs.sigchi.org/chi/2026/program/content/230103",
    "raw": {
      "affiliation": "Australian National University",
      "item_id": "230103",
      "item_type": "Interactivity",
      "title": "Last Christmas I Gave You My Heart: This Christmas I am Taking It Back with Multimodal XR\n",
      "item_url": "https://programs.sigchi.org/chi/2026/program/content/230103",
      "authors": "Dezijian Zhou , Yuanyuan Deng , Anastasia Globa , Julie Zheng , Renxuan Liu , Xingting Wu , Tianrui Liu , Donald Degraen , Aaron Quigley",
      "authors_with_affiliations": "",
      "Awards": ""
    }
  },
  {
    "title": "PerEye: Co-Designing Extended Reality Rendering Attributes for Vision Health Diagnosis and Education",
    "category": "Papers",
    "sessionTime": "",
    "authors": [
      "Howe Yuan Zhu",
      "Jacinta Anne Walz",
      "Nguyen Thanh Trung Le",
      "Raymond Chia",
      "Wenjing Su",
      "Nissi Faith Obra",
      "Ian Chivers",
      "Kristine Nussbaum",
      "Christopher Hodge",
      "Chin-Teng Lin",
      "Vincent Nguyen"
    ],
    "link": "https://programs.sigchi.org/chi/2026/program/content/222363",
    "raw": {
      "affiliation": "Australian AI Institute, School of Computer Science, Faculty of Engineering and Information Technology, University of Technology Sydney",
      "item_id": "222363",
      "item_type": "Papers",
      "title": "PerEye: Co-Designing Extended Reality Rendering Attributes for Vision Health Diagnosis and Education",
      "item_url": "https://programs.sigchi.org/chi/2026/program/content/222363",